{"protocolVersion":1,"type":"gm-update","turnId":"turn-0009","milestoneId":"establish-life-support-pressure","runStatus":"continue","operations":[],"capabilityRequests":[],"privateNotes":"The current validated actions already provide coherent survival preparation and airlock traversal choices; this outcome does not warrant additional content."}
