{"protocolVersion":1,"type":"gm-update","turnId":"turn-0005","milestoneId":"enter-starting-room","runStatus":"continue","operations":[{"op":"upsert","contentType":"items","value":{"id":"space-suit","maxQuantity":1}},{"op":"upsert","contentType":"items","value":{"id":"air-canister","maxQuantity":2}},{"op":"upsert","contentType":"items","value":{"id":"water-pouch","maxQuantity":1}},{"op":"upsert","contentType":"items","value":{"id":"food-ration","maxQuantity":1}},{"op":"upsert","contentType":"actions","value":{"id":"open-emergency-locker","locationId":"cryobay","durationSeconds":8,"maxCompletions":1,"rewards":[],"results":[{"kind":"item","itemId":"space-suit","amount":1},{"kind":"item","itemId":"air-canister","amount":2},{"kind":"item","itemId":"water-pouch","amount":1},{"kind":"item","itemId":"food-ration","amount":1}]}},{"op":"upsert","contentType":"actions","value":{"id":"inspect-cryobay-airlock","locationId":"cryobay","durationSeconds":5,"maxCompletions":1,"rewards":[]}},{"op":"upsert","contentType":"actions","value":{"id":"watch-the-stars","locationId":"cryobay","durationSeconds":7,"maxCompletions":1,"rewards":[]}},{"op":"upsert","contentType":"actions","value":{"id":"check-cryobay-console","locationId":"cryobay","durationSeconds":6,"maxCompletions":1,"rewards":[]}},{"op":"localize","locale":"en","values":{"item.space-suit.title":"Spacesuit","item.space-suit.description":"A sealed utility suit with an integral air system.","item.air-canister.title":"Air Canister","item.air-canister.description":"A compact replacement canister for the suit recycler.","item.water-pouch.title":"Water Pouch","item.water-pouch.description":"A small sealed pouch of drinking water.","item.food-ration.title":"Food Ration","item.food-ration.description":"A dense emergency ration in foil packaging.","action.open-emergency-locker.title":"Open the Emergency Locker","action.open-emergency-locker.description":"Force open the marked locker beside the airlock.","action.open-emergency-locker.success":"The warped door yields. A folded spacesuit hangs inside beside two air canisters, one water pouch, and a single foil ration.","action.open-emergency-locker.failure":"The locker door flexes against its bent frame but does not release.","action.inspect-cryobay-airlock.title":"Inspect the Airlock","action.inspect-cryobay-airlock.description":"Check the only intact exit and its pressure controls.","action.inspect-cryobay-airlock.success":"The inner door still seals. Its panel shows vacuum beyond and warns that opening it will vent the cryobay through damaged equalization valves.","action.inspect-cryobay-airlock.failure":"The pressure display flickers between unreadable values. The inner door remains locked in its frame.","action.watch-the-stars.title":"Watch the Stars","action.watch-the-stars.description":"Study the strip of star field visible through the fractured outer wall.","action.watch-the-stars.success":"The stars drift with the vessel, stop, then retrace several seconds of motion before continuing. Loose frost on the glass does not move with them.","action.watch-the-stars.failure":"Reflections from the failing status lights cross the glass. The stars remain difficult to track.","action.check-cryobay-console.title":"Check the Cryobay Console","action.check-cryobay-console.description":"Wake the room console and review the remaining ship systems.","action.check-cryobay-console.success":"Most compartments return no signal. A main intersection and the captain's deck still answer, but the route begins beyond the airlock.","action.check-cryobay-console.failure":"The console wakes to a field of dead compartment indicators, then loses power."}}],"capabilityRequests":[],"privateNotes":"The cryobay now offers finite survival supplies, a dangerous exit to assess, the first temporal observation, and a concrete route deeper into the vessel."}
