{"protocolVersion":1,"type":"gm-update","turnId":"turn-0008","milestoneId":"establish-life-support-pressure","runStatus":"continue","operations":[],"capabilityRequests":[],"privateNotes":"The console outcome confirms that the route begins beyond the airlock. Existing suit, airlock, canister, and traversal actions already express the warranted next choices, so no additional side content is needed."}
