{"protocolVersion":1,"type":"gm-update","turnId":"turn-0006","milestoneId":"establish-life-support-pressure","runStatus":"continue","operations":[{"op":"upsert","contentType":"flags","value":{"id":"wearing-space-suit","defaultValue":false}},{"op":"upsert","contentType":"flags","value":{"id":"airlock-open","defaultValue":false}},{"op":"upsert","contentType":"resources","value":{"id":"air","initial":0,"min":0,"max":100,"ratePerMinute":0}},{"op":"upsert","contentType":"actions","value":{"id":"put-on-space-suit","locationId":"cryobay","durationSeconds":8,"maxCompletions":1,"visibleWhen":{"kind":"all","conditions":[{"kind":"item","itemId":"space-suit","comparison":"at-least","value":1},{"kind":"flag","flagId":"wearing-space-suit","value":false}]},"requirements":{"kind":"item","itemId":"space-suit","comparison":"at-least","value":1},"rewards":[],"results":[{"kind":"flag","flagId":"wearing-space-suit","value":true},{"kind":"resource","resourceId":"air","amount":100}]}},{"op":"upsert","contentType":"actions","value":{"id":"open-cryobay-airlock","locationId":"cryobay","durationSeconds":6,"maxCompletions":1,"visibleWhen":{"kind":"all","conditions":[{"kind":"flag","flagId":"wearing-space-suit","value":true},{"kind":"flag","flagId":"airlock-open","value":false}]},"requirements":{"kind":"all","conditions":[{"kind":"flag","flagId":"wearing-space-suit","value":true},{"kind":"resource","resourceId":"air","comparison":"greater-than","value":5}]},"rewards":[],"results":[{"kind":"flag","flagId":"airlock-open","value":true},{"kind":"resource","resourceId":"air","amount":-5}]}},{"op":"localize","locale":"en","values":{"resource.air.title":"Suit Air","resource.air.description":"Breathable air remaining in the spacesuit system.","action.put-on-space-suit.title":"Put On the Spacesuit","action.put-on-space-suit.description":"Seal the utility suit and start its air system.","action.put-on-space-suit.success":"The neck ring locks after two attempts. The suit stiffens under pressure, and its air gauge climbs to full.","action.put-on-space-suit.failure":"The neck seal folds beneath the locking ring. The suit refuses to pressurize.","action.open-cryobay-airlock.title":"Open the Airlock","action.open-cryobay-airlock.description":"Cycle the inner door and expose the cryobay to vacuum.","action.open-cryobay-airlock.success":"The damaged valves open together. Vapor tears across the deck, the room falls silent, and the airlock indicator turns green.","action.open-cryobay-airlock.failure":"The valves shudder without opening. The inner door remains sealed."}}],"capabilityRequests":[],"privateNotes":"The player expected an option to wear the recovered suit. That action now establishes a concrete air reserve, and opening the airlock records decompression while consuming part of it."}
