{"protocolVersion":1,"type":"gm-update","turnId":"turn-0004","milestoneId":"wake-in-cryopod","runStatus":"continue","operations":[{"op":"upsert","contentType":"actions","value":{"id":"work-manual-release","locationId":"cryopod","durationSeconds":6,"maxCompletions":1,"visibleWhen":{"kind":"action-completions","actionId":"feel-along-lid-seam","comparison":"at-least","value":1},"rewards":[],"results":[{"kind":"relocate","locationId":"cryobay"}]}},{"op":"localize","locale":"en","values":{"action.work-manual-release.title":"Work the Manual Release","action.work-manual-release.description":"Rock the exposed lever until the frozen hinge gives.","action.work-manual-release.success":"The lubricant fractures like thin glass. The lever drops, bolts withdraw around the shell, and the lid rises on exhausted springs.","action.work-manual-release.failure":"The lever moves once, then freezes against its housing. The lid bolts remain seated."}}],"capabilityRequests":[],"privateNotes":"Finding the lever now provides a faster, controlled escape route while forcing the lid remains a slower alternative."}
