{"protocolVersion":1,"type":"gm-update","turnId":"turn-0007","milestoneId":"establish-life-support-pressure","runStatus":"continue","operations":[{"op":"upsert","contentType":"flags","value":{"id":"junction-map-read","initialValue":false}},{"op":"upsert","contentType":"flags","value":{"id":"captain-route-found","initialValue":false}},{"op":"upsert","contentType":"flags","value":{"id":"torn-suit","initialValue":false}},{"op":"upsert","contentType":"locations","value":{"id":"main-intersection","position":{"x":2,"y":0}}},{"op":"upsert","contentType":"actions","value":{"id":"replace-air-canister","locationId":"cryobay","durationSeconds":5,"maxCompletions":2,"visibleWhen":{"kind":"flag","flagId":"wearing-space-suit","value":true},"requirements":{"kind":"all","conditions":[{"kind":"item","itemId":"air-canister","comparison":"at-least","value":1},{"kind":"resource","resourceId":"air","comparison":"at-most","value":50}]},"rewards":[],"results":[{"kind":"item","itemId":"air-canister","amount":-1},{"kind":"resource","resourceId":"air","amount":50}]}},{"op":"upsert","contentType":"actions","value":{"id":"cross-cryobay-airlock","locationId":"cryobay","durationSeconds":10,"maxCompletions":1,"visibleWhen":{"kind":"flag","flagId":"airlock-open","value":true},"requirements":{"kind":"all","conditions":[{"kind":"flag","flagId":"wearing-space-suit","value":true},{"kind":"resource","resourceId":"air","comparison":"greater-than","value":10}]},"rewards":[],"results":[{"kind":"resource","resourceId":"air","amount":-10},{"kind":"relocate","locationId":"main-intersection"}]}},{"op":"upsert","contentType":"actions","value":{"id":"read-junction-map","locationId":"main-intersection","durationSeconds":5,"maxCompletions":1,"requirements":{"kind":"resource","resourceId":"air","comparison":"greater-than","value":5},"rewards":[],"results":[{"kind":"resource","resourceId":"air","amount":-5},{"kind":"flag","flagId":"junction-map-read","value":true}]}},{"op":"upsert","contentType":"actions","value":{"id":"trace-captain-deck-route","locationId":"main-intersection","durationSeconds":7,"maxCompletions":1,"requirements":{"kind":"resource","resourceId":"air","comparison":"greater-than","value":7},"rewards":[],"results":[{"kind":"resource","resourceId":"air","amount":-7},{"kind":"flag","flagId":"captain-route-found","value":true}]}},{"op":"upsert","contentType":"actions","value":{"id":"inspect-intersection-damage","locationId":"main-intersection","durationSeconds":6,"maxCompletions":1,"requirements":{"kind":"resource","resourceId":"air","comparison":"greater-than","value":6},"rewards":[],"results":[{"kind":"resource","resourceId":"air","amount":-6}]}},{"op":"localize","locale":"en","values":{"location.main-intersection.title":"Main Intersection","location.main-intersection.description":"Four unlit corridors meet beneath a cracked navigation panel. Loose wiring hangs motionless in the vacuum.","action.replace-air-canister.title":"Replace an Air Canister","action.replace-air-canister.description":"Consume one spare canister to restore 50 suit air. The gauge must be half empty or lower.","action.replace-air-canister.success":"The empty canister releases with a hard twist. The replacement seats, and the suit gauge climbs by half its full range.","action.replace-air-canister.failure":"The coupling refuses to unlock. No air transfers from the spare canister.","action.cross-cryobay-airlock.title":"Cross the Airlock","action.cross-cryobay-airlock.description":"Leave the vented cryobay and spend suit air crossing into the dark junction.","action.cross-cryobay-airlock.success":"Your boots lock and release across the threshold. Ten points vanish from the air gauge before you reach the main intersection.","action.cross-cryobay-airlock.failure":"The outer hatch binds before you clear it. You retreat into the cryobay with the passage still blocked.","action.read-junction-map.title":"Read the Junction Map","action.read-junction-map.description":"Spend suit air tracing the surviving labels on the navigation panel.","action.read-junction-map.success":"Emergency power reveals four routes: engineering, crew quarters, communications, and the captain's deck. Several intermediate compartments no longer answer.","action.read-junction-map.failure":"The panel dies before its route labels stabilize.","action.trace-captain-deck-route.title":"Trace the Captain's Route","action.trace-captain-deck-route.description":"Follow physical deck markings toward the captain's section while suit air falls.","action.trace-captain-deck-route.success":"A faded command stripe turns into the starboard corridor. Scraped handprints continue along it where the gravity plating failed.","action.trace-captain-deck-route.failure":"Broken wall panels interrupt the command stripe before its direction becomes clear.","action.inspect-intersection-damage.title":"Inspect the Hull Damage","action.inspect-intersection-damage.description":"Use suit air checking the junction for the cause and direction of the breach.","action.inspect-intersection-damage.success":"The wall plates bend outward, away from the vessel's center. A narrow impact groove continues toward communications.","action.inspect-intersection-damage.failure":"Layers of torn insulation conceal the damage beneath the outer plating."}}],"capabilityRequests":[],"privateNotes":"The canisters now have an explicit finite refill action that consumes one canister and restores measurable suit air only when capacity is available. Airlock traversal and every vacuum investigation spend authoritative air, while the destination provides distinct finite choices."}
