{"protocolVersion":1,"type":"gm-update","turnId":"turn-0010","milestoneId":"establish-life-support-pressure","runStatus":"continue","operations":[],"capabilityRequests":[],"privateNotes":"The current action set already supports the next required progression step, and this outcome does not justify additional content."}
