{"protocolVersion":1,"type":"gm-update","turnId":"turn-0003","milestoneId":"wake-in-cryopod","runStatus":"continue","operations":[{"op":"upsert","contentType":"locations","value":{"id":"cryobay","position":{"x":1,"y":0}}},{"op":"upsert","contentType":"actions","value":{"id":"force-pod-lid","locationId":"cryopod","durationSeconds":12,"maxCompletions":1,"visibleWhen":{"kind":"action-completions","actionId":"wipe-frost-from-window","comparison":"at-least","value":1},"rewards":[],"results":[{"kind":"relocate","locationId":"cryobay"}]}},{"op":"localize","locale":"en","values":{"location.cryobay.title":"Cryobay","location.cryobay.description":"Dead cryopods line a compartment open to the star field beyond a fractured outer wall.","action.force-pod-lid.title":"Force the Pod Lid","action.force-pod-lid.description":"Brace against the shell and drive the failed lid actuator open.","action.force-pod-lid.success":"The actuator chatters, catches, and tears free with a metal snap. The lid rises far enough to crawl beneath, spilling cold vapor across the deck.","action.force-pod-lid.failure":"The lid lifts a finger's width before the actuator slips. Frost closes over the gap."}}],"capabilityRequests":[],"privateNotes":"The cleared window now enables direct escape progress while the remaining pod investigations stay optional."}
